tweetDate,twitterId,handle,text,profileUrl,name,tweetLink,timestamp,query
Sat Jun 06 21:36:23 +0000 2020,1016364639729455104,VedhanXeno,@fairyfleurr God you have like the worst pokemon opinions ever val,https://twitter.com/VedhanXeno,TE | TR | Vedhan🇳🇵,https://twitter.com/VedhanXeno/status/1269382654467674119,2021-01-26T18:54:56.281Z,https://twitter.com/search?q=lang%3Aen%20pokemon%20opinions&src=typed_query
Sat Jun 06 19:13:22 +0000 2020,1206763434781663234,fairyfleurr,ferrothorn is the worst pokemon to ever exist i hate that bitch,https://twitter.com/fairyfleurr,valerie,https://twitter.com/fairyfleurr/status/1269346662671175680,2021-01-26T18:54:56.281Z,https://twitter.com/search?q=lang%3Aen%20pokemon%20opinions&src=typed_query
Fri Nov 23 06:49:24 +0000 2018,4109968829,crystaIexarch,Chris Boxerhole fucked someones dad and thinks they have valid pokemon opinions?,https://twitter.com/crystaIexarch,i can fix him,https://twitter.com/crystaIexarch/status/1065859843473453057,2021-01-26T18:54:56.281Z,https://twitter.com/search?q=lang%3Aen%20pokemon%20opinions&src=typed_query
Mon Oct 23 16:40:29 +0000 2017,21360946,tampabayvipers,"everyone hating on my correct pokemon opinions are the same people who called marill ""pikablu"" in elementary school. get behind me satan",https://twitter.com/tampabayvipers,darkest lariat,https://twitter.com/tampabayvipers/status/922503001746616325,2021-01-26T18:54:56.281Z,https://twitter.com/search?q=lang%3Aen%20pokemon%20opinions&src=typed_query
Sat Jan 09 02:28:29 +0000 2021,335537397,TamashiiHiroka,@keelyclove @MysticUmbreon94 I dunno actually I'm not sure what your strongly held pokemon opinions are,https://twitter.com/TamashiiHiroka,Tama Hero,https://twitter.com/TamashiiHiroka/status/1347731941605339136,2021-01-26T18:54:56.281Z,https://twitter.com/search?q=lang%3Aen%20pokemon%20opinions&src=typed_query
Tue Jan 05 22:10:17 +0000 2021,3404275066,GafreitasArt,"Hey, there's a whole bunch of new people here! Hello everyone! 

I'll try to post more art and less bad pokémon opinions haha",https://twitter.com/GafreitasArt,Gabriel Freitas,https://twitter.com/GafreitasArt/status/1346579799578472448,2021-01-26T18:54:56.281Z,https://twitter.com/search?q=lang%3Aen%20pokemon%20opinions&src=typed_query
Sat Jun 04 23:13:02 +0000 2016,1949740303,ColdmanHot,you absolutely want my fire Pokemon opinions https://t.co/cspDxYgHaD,https://twitter.com/ColdmanHot,twenty-twenty-thom,https://twitter.com/ColdmanHot/status/739233529310117888,2021-01-26T18:54:56.281Z,https://twitter.com/search?q=lang%3Aen%20pokemon%20opinions&src=typed_query
Fri Feb 12 03:15:12 +0000 2016,93275632,mattoak,I'm Professor Oak don't even come at me with wrong Pokémon opinions,https://twitter.com/mattoak,Matt Oak,https://twitter.com/mattoak/status/697982256342650880,2021-01-26T18:54:56.281Z,https://twitter.com/search?q=lang%3Aen%20pokemon%20opinions&src=typed_query
Mon Jun 17 10:25:49 +0000 2019,2218261077,YTSunnys,My Twitter follower count after my controversial Pokemon opinions https://t.co/10f4vjZgWT,https://twitter.com/YTSunnys,Sunny ✨,https://twitter.com/YTSunnys/status/1140566206690275329,2021-01-26T18:54:56.281Z,https://twitter.com/search?q=lang%3Aen%20pokemon%20opinions&src=typed_query
Wed May 21 04:54:23 +0000 2014,14788340,EsperControl,guess who got some Pokemon Opinions: it's @bigshoesplease,https://twitter.com/EsperControl,Esper Quinn,https://twitter.com/EsperControl/status/468978086579826688,2021-01-26T18:54:56.281Z,https://twitter.com/search?q=lang%3Aen%20pokemon%20opinions&src=typed_query
Sun Jun 21 16:27:06 +0000 2020,69429602,Infindox,"Unlike most people, most Pokemon opinions I respect because I see where people are coming from. It's dependant on age/what game you started with/general likes.

.... Except Genwunners and people who say it sucked after gen 2, you can get your ass outta here.",https://twitter.com/Infindox,Torrie Starfrost,https://twitter.com/Infindox/status/1274740639150886912,2021-01-26T18:54:56.281Z,https://twitter.com/search?q=lang%3Aen%20pokemon%20opinions&src=typed_query
Sun Jun 21 16:00:08 +0000 2020,1142068877783781376,BringBackNatDex,"Gen 5 is trending, so here's a reminder that Gen 4 and Gen 5 are the peak of Pokemon https://t.co/fi1nV9eHVK",https://twitter.com/BringBackNatDex,Dex Guy 🍥,https://twitter.com/BringBackNatDex/status/1274733850464153602,2021-01-26T18:54:56.281Z,https://twitter.com/search?q=lang%3Aen%20pokemon%20opinions&src=typed_query
Tue May 10 17:38:05 +0000 2016,1284858900,KyleWithAnN,"If we all get in our sea bear protection circle, then maybe we'll be safe from @_jewstin 's shitty Pokemon opinions.",https://twitter.com/KyleWithAnN,Kylen,https://twitter.com/KyleWithAnN/status/730089541273411585,2021-01-26T18:54:56.281Z,https://twitter.com/search?q=lang%3Aen%20pokemon%20opinions&src=typed_query
Thu Nov 26 20:48:14 +0000 2020,1147626277769220096,richlesbianceo_,"these are my pokemon opinions thanks
usum would be lower if you consider how quickly they came out after SM but ignoring that they're solid https://t.co/TqP0BEIx3a",https://twitter.com/richlesbianceo_,17 cats stacked in a trenchcoat,https://twitter.com/richlesbianceo_/status/1332063639289950211,2021-01-26T18:54:56.281Z,https://twitter.com/search?q=lang%3Aen%20pokemon%20opinions&src=typed_query
Fri Jan 22 01:47:16 +0000 2021,427616106,nataliereed84,"@EnifaelArt @TnashiAC @BeakyDoctor @JamesCraigie @PenisPillGril @marbo_real @JamesGr72711188 @LordJolemai @TheMindflayer99 @the_frishman @Luna_Lumen_Fox Come to think of it, I think he's done THREE Bad Pokemon Opinions Threads so far…",https://twitter.com/nataliereed84,🦇 Gal Fieri 🦇,https://twitter.com/nataliereed84/status/1352432614645227522,2021-01-26T18:54:56.281Z,https://twitter.com/search?q=lang%3Aen%20pokemon%20opinions&src=typed_query
Sat Dec 01 13:30:24 +0000 2018,2231616750,Mrjamesgifford,@DroppedEP404 So brave. I am but a lone voice standing defiant in a maelstrom of furious Pokemon opinions.,https://twitter.com/Mrjamesgifford,mrjamesgifford,https://twitter.com/Mrjamesgifford/status/1068859864913453058,2021-01-26T18:54:56.281Z,https://twitter.com/search?q=lang%3Aen%20pokemon%20opinions&src=typed_query
Wed Feb 12 02:50:17 +0000 2020,2932352158,Defiant_Drills,My pokemon opinions are bad https://t.co/RbKY0MYYek,https://twitter.com/Defiant_Drills,Gatsby 🪄✨,https://twitter.com/Defiant_Drills/status/1227424656765919237,2021-01-26T18:54:56.281Z,https://twitter.com/search?q=lang%3Aen%20pokemon%20opinions&src=typed_query
Sat Jan 09 02:27:38 +0000 2021,707116552340905984,keelyclove,@TamashiiHiroka @MysticUmbreon94 is this video going to make my eye twitch,https://twitter.com/keelyclove,keel🌨,https://twitter.com/keelyclove/status/1347731730766053376,2021-01-26T18:54:56.281Z,https://twitter.com/search?q=lang%3Aen%20pokemon%20opinions&src=typed_query
Sat Jun 20 21:58:14 +0000 2020,879408883051245568,Amytitt,Quote tweet or reply with your controversal Pokémon opinions https://t.co/WREArsFS8U,https://twitter.com/Amytitt,Björk’s Precum republicaphobic era,https://twitter.com/Amytitt/status/1274461583532601347,2021-01-26T18:54:56.281Z,https://twitter.com/search?q=lang%3Aen%20pokemon%20opinions&src=typed_query
Sun Feb 28 05:12:03 +0000 2016,868481035,sgoetter,I've been drinking and I have POKEMON OPINIONS,https://twitter.com/sgoetter,Sara Goetter @ Buy Dungeon Critters!!,https://twitter.com/sgoetter/status/703809867715375104,2021-01-26T18:54:56.281Z,https://twitter.com/search?q=lang%3Aen%20pokemon%20opinions&src=typed_query
Tue May 12 18:38:42 +0000 2015,19779701,radiopomp,This guy doesn't have bad Pokemon opinions at least http://t.co/E6qzcCFp8O,https://twitter.com/radiopomp,juicy,https://twitter.com/radiopomp/status/598195613407252481,2021-01-26T18:54:56.281Z,https://twitter.com/search?q=lang%3Aen%20pokemon%20opinions&src=typed_query
Sun Nov 01 14:46:22 +0000 2020,3608898442,Suffi__,@OhWzky Black &amp; White &gt;,https://twitter.com/Suffi__,Chris!,https://twitter.com/Suffi__/status/1322912872742211584,2021-01-26T18:54:56.281Z,https://twitter.com/search?q=lang%3Aen%20pokemon%20opinions&src=typed_query
Thu Nov 02 01:09:55 +0000 2017,1604615323,TheTrainerMat,"Somehow, Twitter unblocked Verlis, saw a tweet of his claiming people should kill themselves over Pokémon opinions. Blocked back 😥",https://twitter.com/TheTrainerMat,Trainer Mat,https://twitter.com/TheTrainerMat/status/925892695058415617,2021-01-26T18:54:56.281Z,https://twitter.com/search?q=lang%3Aen%20pokemon%20opinions&src=typed_query
Wed Jan 27 22:51:29 +0000 2016,162463811,Orcanist,I can’t believe it’s 2016 and I still have strongly-held pokemon opinions,https://twitter.com/Orcanist,several gay monsters,https://twitter.com/Orcanist/status/692480071785910272,2021-01-26T18:54:56.281Z,https://twitter.com/search?q=lang%3Aen%20pokemon%20opinions&src=typed_query
Thu Feb 28 13:51:38 +0000 2019,54343756,AmmoniteInk,"Hi I see that it’s “everyone yelling Pokémon opinions” say, so let me just say:

Whooper. https://t.co/HqFncZd1zU",https://twitter.com/AmmoniteInk,Lee Brontide,https://twitter.com/AmmoniteInk/status/1101117726494466049,2021-01-26T18:54:56.281Z,https://twitter.com/search?q=lang%3Aen%20pokemon%20opinions&src=typed_query
Mon Nov 12 18:18:03 +0000 2018,361270485,sanigo_,"I like how me and my friends are all rational, open and understanding people who'd never waste their time with shit like fandom wars or whatever but we all have aggressive opinions about pokemon and tbh anyone doesn't agree with my pokemon opinions can go to hell",https://twitter.com/sanigo_,◒✧PHI,https://twitter.com/sanigo_/status/1062046884603330561,2021-01-26T18:54:56.281Z,https://twitter.com/search?q=lang%3Aen%20pokemon%20opinions&src=typed_query
Tue Jan 22 21:31:03 +0000 2019,81613504,midgee_,Follow for more niche Pokemon opinions,https://twitter.com/midgee_,Bethany,https://twitter.com/midgee_/status/1087824993134743554,2021-01-26T18:54:56.281Z,https://twitter.com/search?q=lang%3Aen%20pokemon%20opinions&src=typed_query
Tue Feb 20 02:04:29 +0000 2018,427616106,nataliereed84,"All my pokemon opinions are based on nothing but aesthetics.

Obviously.",https://twitter.com/nataliereed84,🦇 Gal Fieri 🦇,https://twitter.com/nataliereed84/status/965769092505395201,2021-01-26T18:54:56.281Z,https://twitter.com/search?q=lang%3Aen%20pokemon%20opinions&src=typed_query
Fri Dec 06 21:19:53 +0000 2019,1155939873951535105,tensaikendo,"I’ll never trust Twitter with Pokémon opinions again, Hop is a good rival already imo",https://twitter.com/tensaikendo,Kendo,https://twitter.com/tensaikendo/status/1203061524220301318,2021-01-26T18:54:56.281Z,https://twitter.com/search?q=lang%3Aen%20pokemon%20opinions&src=typed_query
Mon Oct 14 02:54:37 +0000 2013,75223454,CountCaleb,you guys have bad pokemon opinions,https://twitter.com/CountCaleb,caleb (hard mode),https://twitter.com/CountCaleb/status/389585004839202817,2021-01-26T18:54:56.281Z,https://twitter.com/search?q=lang%3Aen%20pokemon%20opinions&src=typed_query
Mon May 06 03:39:07 +0000 2019,2872574203,T3chJ3t,@GuardianYoshi @incapablehuman @Jackamacka1 pretty much all of your pokemon opinions are trash so this seems completely in line with your character yeah,https://twitter.com/T3chJ3t,Tech Jet,https://twitter.com/T3chJ3t/status/1125243567872458752,2021-01-26T18:54:56.281Z,https://twitter.com/search?q=lang%3Aen%20pokemon%20opinions&src=typed_query
Tue Dec 29 22:15:00 +0000 2020,403519230,Patterrz,"Send me your unpopular #Pokemon opinions 

i'll start:
I don't want Diamond and Pearl remakes, The Pokemon Company already gets away with selling the same content over and over a lot &amp; i'd much rather have a direct sequel to Platinum instead if it HAD to be Sinnoh related https://t.co/9bYjO5cLZN",https://twitter.com/Patterrz,🔴LIVE NOW on Twitch (Daniel),https://twitter.com/Patterrz/status/1344044271918346252,2021-01-26T18:54:56.281Z,https://twitter.com/search?q=lang%3Aen%20pokemon%20opinions&src=typed_query
Sun Jun 09 18:16:12 +0000 2019,888571220437999617,vergolophus,What /is it/ with talking about pokemon opinions that makes people flock to those posts...,https://twitter.com/vergolophus,✨Vergo/ベルゴさん✨,https://twitter.com/vergolophus/status/1137785481960275974,2021-01-26T18:54:56.281Z,https://twitter.com/search?q=lang%3Aen%20pokemon%20opinions&src=typed_query
Thu Sep 10 19:23:33 +0000 2020,723115815768342528,ScotWresNet,"Just wrapped up my chat with @Tallon_JR which was a lot of fun, some audio dips but I know it won’t spoil your enjoyment of the episode once it goes out at the start of October. Some controversial Pokemon opinions!",https://twitter.com/ScotWresNet,🆂🆆🅽 | Scottish Wrestling Network,https://twitter.com/ScotWresNet/status/1304138460631109638,2021-01-26T18:54:56.281Z,https://twitter.com/search?q=lang%3Aen%20pokemon%20opinions&src=typed_query
Wed Nov 14 18:30:13 +0000 2018,3140626422,enosetc,"can people get out of my mentions with ""you were clearly born after X year"" over pokemon opinions y'all the new age boomers

also i'm 24",https://twitter.com/enosetc,eno,https://twitter.com/enosetc/status/1062774721513750530,2021-01-26T18:54:56.281Z,https://twitter.com/search?q=lang%3Aen%20pokemon%20opinions&src=typed_query
Fri Apr 05 16:21:37 +0000 2019,735663349912981504,HexMW,Yall don’t wanna see my pokemon tier list my pokemon opinions are objectively bad,https://twitter.com/HexMW,Hex,https://twitter.com/HexMW/status/1114201435724447745,2021-01-26T18:54:56.281Z,https://twitter.com/search?q=lang%3Aen%20pokemon%20opinions&src=typed_query
Tue Sep 01 15:20:04 +0000 2020,4648904601,sunmosibs,UNPOPULAR POKEMON OPINIONS !! (please tag hate on characters and game when you reply with these so nobody feels sad !!! Also try not to be mean in general!!) https://t.co/FWDoRZClSn,https://twitter.com/sunmosibs,☆hugo oak ;,https://twitter.com/sunmosibs/status/1300815697229078528,2021-01-26T18:54:56.281Z,https://twitter.com/search?q=lang%3Aen%20pokemon%20opinions&src=typed_query
Sat Sep 12 21:38:05 +0000 2015,417511365,WindyFlamingo,SUDDENLY POKEMON OPINIONS idk tho im always happy with a pokemon game in the end hahahaha,https://twitter.com/WindyFlamingo,the villainous bird lady department,https://twitter.com/WindyFlamingo/status/642814463247192064,2021-01-26T18:54:56.281Z,https://twitter.com/search?q=lang%3Aen%20pokemon%20opinions&src=typed_query
Thu Oct 22 20:13:44 +0000 2020,3832144933,Violetferret,"One of the best takes about the Pokemon animated series I've heard, and I don't even agree with most of Lily Orchard's Pokemon opinions. https://t.co/kMv0KIVGom",https://twitter.com/Violetferret,Richter Taylor,https://twitter.com/Violetferret/status/1319371379943165952,2021-01-26T18:54:56.281Z,https://twitter.com/search?q=lang%3Aen%20pokemon%20opinions&src=typed_query
Sun Nov 18 23:55:39 +0000 2018,2848000859,evegwood,i have a lot of pokemon opinions and alex is doing you all a favour by carrying the burden of listening to them while our internet is down,https://twitter.com/evegwood,⚠️ eve g ⚠️,https://twitter.com/evegwood/status/1064306168942796800,2021-01-26T18:54:56.281Z,https://twitter.com/search?q=lang%3Aen%20pokemon%20opinions&src=typed_query
Wed Jun 17 21:55:13 +0000 2020,18427576,apricotsushi,"It goes without saying that I too am excited for Pokémon Snap, so here are some other Pokémon opinions 
1. The tooth brushing app features art by kanahei, so of course I downloaded it immediately 
2. Pokémon food!! https://t.co/jDmreIaRPT",https://twitter.com/apricotsushi,"Anne Lee, Yaoi PhD ☕️",https://twitter.com/apricotsushi/status/1273373659327938560,2021-01-26T18:54:56.281Z,https://twitter.com/search?q=lang%3Aen%20pokemon%20opinions&src=typed_query
Sat Dec 07 06:02:55 +0000 2019,3766150993,MrShyGuyBuddy,"Welcome to Pokemon Opinions with Mr Buddy. Todays topic is Pokemon Champions:

Top 3 Pokemon Champs: Cynthia, Steven, Kukui

Bottom 3 Pokemon Champs: Trace, Diantha, Leon (though his theme is awesome)",https://twitter.com/MrShyGuyBuddy,Mr Buddy,https://twitter.com/MrShyGuyBuddy/status/1203193148228300806,2021-01-26T18:54:56.281Z,https://twitter.com/search?q=lang%3Aen%20pokemon%20opinions&src=typed_query
Thu Nov 19 17:04:49 +0000 2020,132374223,kaycreigh,Respond to this tweet with your most unpopular Pokémon opinions,https://twitter.com/kaycreigh,Kaylynn Creighton,https://twitter.com/kaycreigh/status/1329470697308004352,2021-01-26T18:54:56.281Z,https://twitter.com/search?q=lang%3Aen%20pokemon%20opinions&src=typed_query
Fri Mar 01 15:26:04 +0000 2019,854532807321731075,LUOIAE,Everyone shut up with ur pokemon opinions I can't concentrate knowing Hozier is out there with a new album and I'm here on the train unable to bless my ears with the thick ropes of c*m that is his MUSIC,https://twitter.com/LUOIAE,luoiae,https://twitter.com/LUOIAE/status/1101503879613542400,2021-01-26T18:54:56.281Z,https://twitter.com/search?q=lang%3Aen%20pokemon%20opinions&src=typed_query
Thu Jul 04 02:49:23 +0000 2019,1551480200,gearstation,"@hellpupps i get so steamed when i think about the two men that tried to hit on little baby me by baiting me with bad pokemon opinions

I do fondly remember the guy who said “Oh! Cute! (gets closer look) Wait how old are you” and then fastwalked away when i said “15”",https://twitter.com/gearstation,Lemley (joined the deliverance),https://twitter.com/gearstation/status/1146611939101069313,2021-01-26T18:54:56.281Z,https://twitter.com/search?q=lang%3Aen%20pokemon%20opinions&src=typed_query
Fri May 03 20:15:35 +0000 2019,2324342473,Truegreen7,@Speqtor You should eventually change the title to Pokemon Opinions for better search optimization.,https://twitter.com/Truegreen7,Ron,https://twitter.com/Truegreen7/status/1124407173721874432,2021-01-26T18:54:56.281Z,https://twitter.com/search?q=lang%3Aen%20pokemon%20opinions&src=typed_query
Fri Aug 26 20:53:24 +0000 2016,2517982632,BeachEpisode,Just read Brianna Wu's spicy Pokemon opinions... Quite controversial but she raises some very valid points https://t.co/uPmQ9bl4u0,https://twitter.com/BeachEpisode,Motherboard Slumd0g from the WetWork NetWork,https://twitter.com/BeachEpisode/status/769276581932138497,2021-01-26T18:54:56.281Z,https://twitter.com/search?q=lang%3Aen%20pokemon%20opinions&src=typed_query
Wed Jul 29 15:10:51 +0000 2020,808374987442843648,PnguinsWitCapes,"Some people say that Pokémon Gen 1 is overrated. Those people include the infamous @Tzurki. Join me today as I take him to task for his bad Pokémon opinions in the newest @BackLogBanter discussion!

https://t.co/QVmTCRxlq0 https://t.co/nrgBzRxWcc",https://twitter.com/PnguinsWitCapes,Abram Buehner,https://twitter.com/PnguinsWitCapes/status/1288492188742176769,2021-01-26T18:54:56.281Z,https://twitter.com/search?q=lang%3Aen%20pokemon%20opinions&src=typed_query
Wed Feb 27 19:09:03 +0000 2019,28508004,Tis_Not_Love,lots of #pokemon opinions recently https://t.co/BDeTGjHFTk,https://twitter.com/Tis_Not_Love,Kressent Rhodes,https://twitter.com/Tis_Not_Love/status/1100835218448101376,2021-01-26T18:54:56.281Z,https://twitter.com/search?q=lang%3Aen%20pokemon%20opinions&src=typed_query
Thu Jul 30 01:05:45 +0000 2020,191773988,TheRaichu_,You guys really liked my sandshrew tweet so much so my new content is talking about what pokemon are good... I ALSO REALLY LIKE BUIZELS LIKE A LOT,https://twitter.com/TheRaichu_,RAICHUUUUUUU,https://twitter.com/TheRaichu_/status/1288641900539293696,2021-01-26T18:54:56.281Z,https://twitter.com/search?q=lang%3Aen%20pokemon%20opinions&src=typed_query
Thu Aug 31 19:09:16 +0000 2017,404655093,Noontide108,here they are. my hot pokemon opinions revealed. https://t.co/W7YuzQ1N9k,https://twitter.com/Noontide108,yuyuko saigyouji 200 lbs,https://twitter.com/Noontide108/status/903333885773307904,2021-01-26T18:54:56.281Z,https://twitter.com/search?q=lang%3Aen%20pokemon%20opinions&src=typed_query
Tue Feb 20 02:04:01 +0000 2018,427616106,nataliereed84,"Grass is, appropraiteely, safe steady and consistent.",https://twitter.com/nataliereed84,🦇 Gal Fieri 🦇,https://twitter.com/nataliereed84/status/965768977216561152,2021-01-26T18:54:56.281Z,https://twitter.com/search?q=lang%3Aen%20pokemon%20opinions&src=typed_query
Sun Oct 06 18:26:28 +0000 2019,164116554,DigiAtlas,"@sman_mmo @AaSnoozie My dude... why are you here? You don't follow Snoozie

No harassment intended. Just curious because you came in (did you search for negative Pokémon opinions???) insulted Snoozie, and now are saying his followers are gonna harass you? Everything okay at home dude?",https://twitter.com/DigiAtlas,James,https://twitter.com/DigiAtlas/status/1180912220865208320,2021-01-26T18:54:56.281Z,https://twitter.com/search?q=lang%3Aen%20pokemon%20opinions&src=typed_query
Thu Feb 28 09:59:03 +0000 2019,829848860126244864,rosiesrambles,"Y'all just wait till everyone in America wakes up, because I have Pokemon opinions and they WILL be HEARD https://t.co/qOUdptHKtt",https://twitter.com/rosiesrambles,Roseanne A. Brown says Vaccinate Ya Kids! ✨,https://twitter.com/rosiesrambles/status/1101059195015618561,2021-01-26T18:54:56.281Z,https://twitter.com/search?q=lang%3Aen%20pokemon%20opinions&src=typed_query
Fri Dec 18 01:25:00 +0000 2020,807471523351007233,PopplioStan2001,Pokémon opinions that’ll have everyone acting like this? https://t.co/xmWPozO79P,https://twitter.com/PopplioStan2001,Shuffle Popplio (3 Week Hiatus),https://twitter.com/PopplioStan2001/status/1339743433129226240,2021-01-26T18:54:56.281Z,https://twitter.com/search?q=lang%3Aen%20pokemon%20opinions&src=typed_query
Sat Nov 16 15:36:12 +0000 2019,2159340289,DevPalmer,i really like the way swsh handles its gym battles. i wasnt sold on it from the trailers but ingame it feels really cinematic and cool to see the stadium crowd. and dynamaxing is actually so fun and stupid dramatic,https://twitter.com/DevPalmer,it's dev!,https://twitter.com/DevPalmer/status/1195727276081586176,2021-01-26T18:54:56.281Z,https://twitter.com/search?q=lang%3Aen%20pokemon%20opinions&src=typed_query
Thu Jul 30 01:40:15 +0000 2020,2517098095,CoffeeCatSnake,"@TheRaichu_ BUIZELS ARE VERY GOOD

Honestly you just have good pokemon opinions, but I expect nothing less from you",https://twitter.com/CoffeeCatSnake,Macchi Ato(matic) Dook #BlackLivesMatter,https://twitter.com/CoffeeCatSnake/status/1288650583608406016,2021-01-26T18:54:56.281Z,https://twitter.com/search?q=lang%3Aen%20pokemon%20opinions&src=typed_query
Thu Jul 12 21:08:13 +0000 2018,153645072,Qwarq,These are the worst pokemon opinions I've ever seen @Emeraldrox303 https://t.co/qkdEzarjlZ,https://twitter.com/Qwarq,Qwarq,https://twitter.com/Qwarq/status/1017515999913041920,2021-01-26T18:54:56.281Z,https://twitter.com/search?q=lang%3Aen%20pokemon%20opinions&src=typed_query
Thu Mar 14 01:13:23 +0000 2019,3399942793,WiiTwerkTrainer,"Pokemon opinions of mine

*Ice type is easily the worst typing in the game. Buff it

*Psychic is a worse Fairy type. Fairy outclasses it

*Steel and Fairy types needs nerfs

*Ghost Pokemon would be broken if they had stronger moves and better base stats

*Dragon type is meh now",https://twitter.com/WiiTwerkTrainer,Wii Twerk Trainer 🇬🇹🐈,https://twitter.com/WiiTwerkTrainer/status/1106000337373007872,2021-01-26T18:54:56.281Z,https://twitter.com/search?q=lang%3Aen%20pokemon%20opinions&src=typed_query
Thu Jan 09 21:26:04 +0000 2020,2887920795,premydaremy,"@twip98 They're not unfollowing because of negative Pokémon opinions

They're unfollowing because of Pokémon opinions when they should be getting only the Sonic opinions",https://twitter.com/premydaremy,PREM.,https://twitter.com/premydaremy/status/1215384265329979395,2021-01-26T18:54:56.281Z,https://twitter.com/search?q=lang%3Aen%20pokemon%20opinions&src=typed_query
Tue Jan 22 21:30:00 +0000 2019,81613504,midgee_,Rockruff making Rowlet faint is truly the greatest anime betrayal of all time https://t.co/5847dKPM8l,https://twitter.com/midgee_,Bethany,https://twitter.com/midgee_/status/1087824725672374272,2021-01-26T18:54:56.281Z,https://twitter.com/search?q=lang%3Aen%20pokemon%20opinions&src=typed_query
Wed Mar 14 16:45:15 +0000 2018,427616106,nataliereed84,"I'm playing pokemon for literally the first time in my whole life, so yes, there will be pokemon tweets, as I rapidly develop pokemon opinions.",https://twitter.com/nataliereed84,🦇 Gal Fieri 🦇,https://twitter.com/nataliereed84/status/973963278169776128,2021-01-26T18:54:56.281Z,https://twitter.com/search?q=lang%3Aen%20pokemon%20opinions&src=typed_query
Wed Oct 12 16:02:29 +0000 2016,252709879,Nucleose,"Redirect your ire at my bad pokemon opinions instead, it's more worthwhile and fun https://t.co/xAZKqlThUM",https://twitter.com/Nucleose,Yan,https://twitter.com/Nucleose/status/786235602878464000,2021-01-26T18:54:56.281Z,https://twitter.com/search?q=lang%3Aen%20pokemon%20opinions&src=typed_query
Sun May 12 19:10:03 +0000 2019,394480655,Diddgery,just like i'm tired of hearing pokemon opinions from people who only liked the first generation i'm tired of hearing sonic opinions from people who only liked the genesis games,https://twitter.com/Diddgery,Millie,https://twitter.com/Diddgery/status/1127652173268103168,2021-01-26T18:54:56.281Z,https://twitter.com/search?q=lang%3Aen%20pokemon%20opinions&src=typed_query
Wed Jul 31 14:36:15 +0000 2019,20864159,dandock,How I feel as a 30-year-old whenever I share my Pokemon opinions on Twitter: https://t.co/ICu1c2y504,https://twitter.com/dandock,Daniel Dockery,https://twitter.com/dandock/status/1156574297881755650,2021-01-26T18:54:56.281Z,https://twitter.com/search?q=lang%3Aen%20pokemon%20opinions&src=typed_query
Wed Feb 27 22:15:18 +0000 2019,1000476390,editedthought,Molly and I have a big date planned for the day and I think I just blew it all with my Pokémon Opinions,https://twitter.com/editedthought,Sage Howard,https://twitter.com/editedthought/status/1100882092852862976,2021-01-26T18:54:56.281Z,https://twitter.com/search?q=lang%3Aen%20pokemon%20opinions&src=typed_query
