tweetDate,twitterId,handle,text,profileUrl,name,tweetLink,timestamp,query
Sun Jun 21 10:43:48 +0000 2020,931934216060919809,CoupleCakesYT,"It's time to share your unpopular Pokémon opinions!

Gotta offend 'em all! https://t.co/Or8abxketi",https://twitter.com/CoupleCakesYT,Couple Cakes,https://twitter.com/CoupleCakesYT/status/1274654242998030337,2021-01-26T18:54:56.281Z,https://twitter.com/search?q=lang%3Aen%20pokemon%20opinions&src=typed_query
Fri Oct 14 17:20:52 +0000 2016,737114598,czerwonyrower,true friends will stay together even if the other one has bad pokemon opinions,https://twitter.com/czerwonyrower,Gdzie w śniegach nocny wilka trop i zaspy po pas,https://twitter.com/czerwonyrower/status/786980101086937088,2021-01-26T18:54:56.281Z,https://twitter.com/search?q=lang%3Aen%20pokemon%20opinions&src=typed_query
Thu Dec 10 21:29:16 +0000 2020,779877183363883008,warphammock,every time im home i reread this old pokemon magazine thing. no clue what the hell it is and ive only ever seen this one. but if u ever were wondering what the spy kids' pokemon opinions were circa 2006 here there are https://t.co/2XNRm4I705,https://twitter.com/warphammock,baby onfim's #1 fan @death stranding spoilers,https://twitter.com/warphammock/status/1337147395642191877,2021-01-26T18:54:56.281Z,https://twitter.com/search?q=lang%3Aen%20pokemon%20opinions&src=typed_query
Thu Oct 01 03:24:42 +0000 2020,3496989436,Swesbian,I have unpopular pokemon opinions and I'm in the mood to get into a facebook debate about it.,https://twitter.com/Swesbian,Sawyer Beaumont,https://twitter.com/Swesbian/status/1311507303464566784,2021-01-26T18:54:56.281Z,https://twitter.com/search?q=lang%3Aen%20pokemon%20opinions&src=typed_query
Sun Oct 09 19:34:55 +0000 2016,322842767,BigLilWeasel,I let out years of pent up #nerd rage on @NWPcast https://t.co/Bog8sRrAwU i +yell about your wrong #pokemon opinions https://t.co/GCXXZSIO61,https://twitter.com/BigLilWeasel,Mike Fallek,https://twitter.com/BigLilWeasel/status/785201897795903492,2021-01-26T18:54:56.281Z,https://twitter.com/search?q=lang%3Aen%20pokemon%20opinions&src=typed_query
Tue Dec 15 23:59:09 +0000 2020,1190656123608739843,ProudPopplio,what are your pokemon opinions that will make the community do this to you? https://t.co/rijtLdf3GN,https://twitter.com/ProudPopplio,lukephobic,https://twitter.com/ProudPopplio/status/1338997052672503810,2021-01-26T18:54:56.281Z,https://twitter.com/search?q=lang%3Aen%20pokemon%20opinions&src=typed_query
Fri Feb 12 03:14:44 +0000 2016,207624369,pkmnelitist,also all of my other pokemon opinions are to be taken seriously,https://twitter.com/pkmnelitist,rabbit medium,https://twitter.com/pkmnelitist/status/697982137220227072,2021-01-26T18:54:56.281Z,https://twitter.com/search?q=lang%3Aen%20pokemon%20opinions&src=typed_query
Mon Nov 06 23:40:45 +0000 2017,2335642412,Anti_Bravoman,why do all my friends have bad pokemon opinions,https://twitter.com/Anti_Bravoman,『┗┻◺ . ◿┻┛』molten hound come home challenge,https://twitter.com/Anti_Bravoman/status/927682194079977472,2021-01-26T18:54:56.281Z,https://twitter.com/search?q=lang%3Aen%20pokemon%20opinions&src=typed_query
Sat Aug 17 00:50:34 +0000 2019,714968171497832450,DuskyGlow,"@KaiKaiKyro ""HELLO POKÉPEOPLE IT'S Y'BOY KAIKAI HERE 'BOUT TO DROP SOME SPICY POKÉMON OPINIONS BUT FIRST CHECK OUT AMINO, MY SPONSOR FOR THIS VIDEO, AND THE VIDEO WILL START AFTER PLUGGING MY FURRY ART PATREON--""",https://twitter.com/DuskyGlow,Dusky ✨,https://twitter.com/DuskyGlow/status/1162527100710137858,2021-01-26T18:54:56.281Z,https://twitter.com/search?q=lang%3Aen%20pokemon%20opinions&src=typed_query
Mon Aug 03 03:47:52 +0000 2020,2513549304,lussuriioso,@popcornparfait hi queen,https://twitter.com/lussuriioso,stephen,https://twitter.com/lussuriioso/status/1290132251402031107,2021-01-26T18:54:56.281Z,https://twitter.com/search?q=lang%3Aen%20pokemon%20opinions&src=typed_query
Wed Nov 28 02:36:37 +0000 2018,241413201,MeldingQuixote,"@SSJSpeedRacer i thought that maybe i went too far in that subtweet, but my god. 

see, this is why i have a hard time agreeing with any of your pokemon opinions.",https://twitter.com/MeldingQuixote,Melding,https://twitter.com/MeldingQuixote/status/1067608170716004352,2021-01-26T18:54:56.281Z,https://twitter.com/search?q=lang%3Aen%20pokemon%20opinions&src=typed_query
Tue Oct 18 03:41:56 +0000 2016,16148004,notveryraven,@madeline_starr @corruptedgem hmm... same,https://twitter.com/notveryraven,☠️2️⃣🇺🇸,https://twitter.com/notveryraven/status/788223564738600961,2021-01-26T18:54:56.281Z,https://twitter.com/search?q=lang%3Aen%20pokemon%20opinions&src=typed_query
Fri Jan 10 22:32:29 +0000 2020,1029151218881445888,EricMaynardII,so far yongyea's voice acting career has started off fantastic with a 15 minute video screaming about pokemon opinions and calling it news,https://twitter.com/EricMaynardII,eric maynard,https://twitter.com/EricMaynardII/status/1215763367765430279,2021-01-26T18:54:56.281Z,https://twitter.com/search?q=lang%3Aen%20pokemon%20opinions&src=typed_query
Thu Aug 22 22:01:29 +0000 2019,367306523,HoodlumCallum,all u mfkers tweeting pokemon opinions when u could turn them into 10 minute clickbait and make bank. smh,https://twitter.com/HoodlumCallum,HoodCal,https://twitter.com/HoodlumCallum/status/1164658876618280960,2021-01-26T18:54:56.281Z,https://twitter.com/search?q=lang%3Aen%20pokemon%20opinions&src=typed_query
Wed Feb 27 15:18:36 +0000 2019,2992433857,hannahselector,"In case anyone was wondering if I have Pokémon opinions, I do and the opinion is Team Fruit Monkey™️ 5ever.",https://twitter.com/hannahselector,Hannah Selector 🎙,https://twitter.com/hannahselector/status/1100777223911546880,2021-01-26T18:54:56.281Z,https://twitter.com/search?q=lang%3Aen%20pokemon%20opinions&src=typed_query
Thu Apr 06 03:11:40 +0000 2017,2605252476,deepbloobersea,"we talking pokemon opinions then?? heres mine:
- slowking is the best pokemon
- gen 5 is the best gen
- FUCK gen 6",https://twitter.com/deepbloobersea,vivienne 🌙,https://twitter.com/deepbloobersea/status/849821884321456128,2021-01-26T18:54:56.281Z,https://twitter.com/search?q=lang%3Aen%20pokemon%20opinions&src=typed_query
Wed Sep 09 06:22:03 +0000 2020,2211339463,collectaBK7,"I can't wait for one of those ""unpopular Pokemon opinions"" thread so I can finally share my hot take.",https://twitter.com/collectaBK7,collectaBK7,https://twitter.com/collectaBK7/status/1303579402375028736,2021-01-26T18:54:56.281Z,https://twitter.com/search?q=lang%3Aen%20pokemon%20opinions&src=typed_query
Sun Mar 03 01:58:48 +0000 2019,2961364133,wolfolotl,okay I gotta go get showered and dressed we're going out to dinner for my mom's birthday,https://twitter.com/wolfolotl,wolfy (of backgrounds fame),https://twitter.com/wolfolotl/status/1102025501990768641,2021-01-26T18:54:56.281Z,https://twitter.com/search?q=lang%3Aen%20pokemon%20opinions&src=typed_query
Sat Feb 08 07:06:49 +0000 2020,1006288984643854337,Sasphemy,I love him💜💙,https://twitter.com/Sasphemy,รคร,https://twitter.com/Sasphemy/status/1226039663250624512,2021-01-26T18:54:56.281Z,https://twitter.com/search?q=lang%3Aen%20pokemon%20opinions&src=typed_query
Thu Oct 01 17:54:51 +0000 2020,1292331896790081537,SANDBlRD,everyone WILL see my pokemon opinions regardless of whether or not they follow me,https://twitter.com/SANDBlRD,goin' peaches,https://twitter.com/SANDBlRD/status/1311726284129492993,2021-01-26T18:54:56.281Z,https://twitter.com/search?q=lang%3Aen%20pokemon%20opinions&src=typed_query
Wed Jan 13 17:51:51 +0000 2021,1069416296373194752,Atomic0730,Since it's #Pokemon25 and I was tossing around the idea of joining poketwitter last night I'm gonna throw in more pokemon opinions https://t.co/18rbAj7o5q,https://twitter.com/Atomic0730,Tom 🏳️‍⚧️,https://twitter.com/Atomic0730/status/1349413868523704326,2021-01-26T18:54:56.281Z,https://twitter.com/search?q=lang%3Aen%20pokemon%20opinions&src=typed_query
Tue Nov 24 15:00:00 +0000 2020,91232555,UnknownNeo,"More Unpopular? #Pokemon Opinions
Aerodactyl kind of counts. We have a T-Rex but we need a Triceratops, Saber Tooth Tiger, &amp; Mammoth Fossil. Why? BECAUSE REFERENCES! That's why.
I don't like the SWiSH Fossils. They seem kind of sad. I wish we got ""normal"" versions too.",https://twitter.com/UnknownNeo,Neo Unknown,https://twitter.com/UnknownNeo/status/1331251227947126784,2021-01-26T18:54:56.281Z,https://twitter.com/search?q=lang%3Aen%20pokemon%20opinions&src=typed_query
Fri Oct 18 01:15:19 +0000 2019,324111234,GlRLPANIC,dudes in the window across the street wrote “sonic x” and we all started cheering and yelling and now they’re fortnite dancing? and asking us about our pokemon opinions ? im losing my mind,https://twitter.com/GlRLPANIC,junpei’s lawyer @ genshin?,https://twitter.com/GlRLPANIC/status/1185001379561115655,2021-01-26T18:54:56.281Z,https://twitter.com/search?q=lang%3Aen%20pokemon%20opinions&src=typed_query
Fri Feb 02 02:21:55 +0000 2018,743585044275539968,ariseroses,@kendrasaras this is your bad cisco pokemon opinions moment,https://twitter.com/ariseroses,abbachio nendoroid,https://twitter.com/ariseroses/status/959250500347662336,2021-01-26T18:54:56.281Z,https://twitter.com/search?q=lang%3Aen%20pokemon%20opinions&src=typed_query
Fri Jun 14 08:39:05 +0000 2019,307082186,supernintenho,I need to stop reading Pokémon opinions on twitter because I think a lot of people are making a big deal about something that just won’t matter in the end,https://twitter.com/supernintenho,"Mels @ good, or don’t be",https://twitter.com/supernintenho/status/1139452184381120513,2021-01-26T18:54:56.281Z,https://twitter.com/search?q=lang%3Aen%20pokemon%20opinions&src=typed_query
Thu May 17 22:08:51 +0000 2018,2586772681,YoungBeku,"Ok Pokémon opinions all in this tweet then im shutting up.
Gen 4 is best Gen
Gen 7 is cool
Gen 7 1/2 is mid 
Gen 6 is trash
Gen 5 isn’t as bad as everyone says
Gen 3 ^ same thing
Gen 2 meh but Gen 4 made me love it 
Gen 1 meh",https://twitter.com/YoungBeku,Beku: Waiting for FFXVI and Extra Remake,https://twitter.com/YoungBeku/status/997237537088442368,2021-01-26T18:54:56.281Z,https://twitter.com/search?q=lang%3Aen%20pokemon%20opinions&src=typed_query
Tue Dec 10 00:02:19 +0000 2019,743649656,NEETscor,"Gonna make a quick thread on my Pokémon opinions

- As a whole, I think Gen 8's fully evolved starters are fine as a whole. The last fully evolved starter line I was okay with/liked as a whole was Gen 4.
- There are mons I miss in SwSh but I'm indifferent to lack of NatDex",https://twitter.com/NEETscor,Marco,https://twitter.com/NEETscor/status/1204189563960168448,2021-01-26T18:54:56.281Z,https://twitter.com/search?q=lang%3Aen%20pokemon%20opinions&src=typed_query
Tue Nov 28 00:00:55 +0000 2017,716817692116848640,RubysBubys,"more pokemon opinions from me: the oras wally theme is only good the first time you hear it, gets repetitive to listen to other wise",https://twitter.com/RubysBubys,ruby,https://twitter.com/RubysBubys/status/935297415397208066,2021-01-26T18:54:56.281Z,https://twitter.com/search?q=lang%3Aen%20pokemon%20opinions&src=typed_query
Sun Jun 21 21:31:11 +0000 2020,1091101409607630848,BrittDoodles,"-Serena &amp; Misty are my least fav female companions
-I 💜 Iris &amp; think her haters go waaay too far
-BW wasn't NEARLY as bad as people say. Ye, it had problems but I enjoyed it more than Johto
-I like SwSh a lot but then again, the only games I've played were Platinum, Black, &amp; 🛡️",https://twitter.com/BrittDoodles,BDOG375 (Commissions Open!),https://twitter.com/BrittDoodles/status/1274817162587312130,2021-01-26T18:54:56.281Z,https://twitter.com/search?q=lang%3Aen%20pokemon%20opinions&src=typed_query
Sun Jun 28 16:55:30 +0000 2020,403519230,Patterrz,"i made my viewers mad at me with my correct #Pokemon opinions lol

https://t.co/0PJiJO7prv https://t.co/CciLMQQva7",https://twitter.com/Patterrz,🔴LIVE NOW on Twitch (Daniel),https://twitter.com/Patterrz/status/1277284499349557249,2021-01-26T18:54:56.281Z,https://twitter.com/search?q=lang%3Aen%20pokemon%20opinions&src=typed_query
Mon Sep 28 02:40:00 +0000 2020,2355005366,glitchplight,"ppl are posting their unpopular pokemon opinions which makes me want to finally post my rant abt backwards compatibility &amp; preservation being a giant issue, but like I got halfway done writing it before becoming exhausted at the idea of interacting with pokemon fans and ex-fans",https://twitter.com/glitchplight,evgay,https://twitter.com/glitchplight/status/1310408891033763840,2021-01-26T18:54:56.281Z,https://twitter.com/search?q=lang%3Aen%20pokemon%20opinions&src=typed_query
Thu Jan 09 16:03:53 +0000 2020,1507954430,LanceKing2200,"I want to be clear about my Pokemon Opinions (tm)

-Yes, they are adding the 200 new (old) mons to SwSh for free, this is a good thing.
-Yes, DLC IS better than a 3rd game, cheaper and you don't have to replay a mostly same story.",https://twitter.com/LanceKing2200,Lance Vance,https://twitter.com/LanceKing2200/status/1215303187277717509,2021-01-26T18:54:56.281Z,https://twitter.com/search?q=lang%3Aen%20pokemon%20opinions&src=typed_query
Fri Oct 14 13:40:15 +0000 2016,2810313109,silvercruiser,Pokemon opinions: theyre all amazing. I love the jingle jangle dragon. I want 20,https://twitter.com/silvercruiser,🌲K!ato🌲✌🏾,https://twitter.com/silvercruiser/status/786924582515118082,2021-01-26T18:54:56.281Z,https://twitter.com/search?q=lang%3Aen%20pokemon%20opinions&src=typed_query
Thu Aug 06 03:45:14 +0000 2020,4899460888,Konsino,"Everyone's talking about their crappy Pokemon opinions again so here's mine I guess.

I play Pokemon for the story, Pokemon Black and White are my favorite games in the series, X and Y is garbage, Sun and Moon are great games despite their flaws. Gen 7 is probably my 2nd fav gen.",https://twitter.com/Konsino,Konsino ✨,https://twitter.com/Konsino/status/1291218750432260099,2021-01-26T18:54:56.281Z,https://twitter.com/search?q=lang%3Aen%20pokemon%20opinions&src=typed_query
Wed Aug 26 02:57:05 +0000 2015,823539672,fagomatic,my Pokemon opinions are more developed than my sense of Self,https://twitter.com/fagomatic,optics understander,https://twitter.com/fagomatic/status/636371759512457216,2021-01-26T18:54:56.281Z,https://twitter.com/search?q=lang%3Aen%20pokemon%20opinions&src=typed_query
Fri Jun 19 02:19:29 +0000 2020,1135015488809869312,FumbleJr,"It's time to put pokemon opinions back on the TL

this time, megas, which could have been interesting but the execution suuuuuuuucked imo https://t.co/HACsexaf28",https://twitter.com/FumbleJr,😼 little lion man,https://twitter.com/FumbleJr/status/1273802555504513027,2021-01-26T18:54:56.281Z,https://twitter.com/search?q=lang%3Aen%20pokemon%20opinions&src=typed_query
Sat Jun 20 21:58:14 +0000 2020,879408883051245568,Amytitt,Quote tweet or reply with your controversal Pokémon opinions https://t.co/WREArsFS8U,https://twitter.com/Amytitt,Björk’s Precum republicaphobic era,https://twitter.com/Amytitt/status/1274461583532601347,2021-01-26T18:54:56.281Z,https://twitter.com/search?q=lang%3Aen%20pokemon%20opinions&src=typed_query
Tue May 12 18:34:39 +0000 2015,19779701,radiopomp,I honest to god can't keep up with everyone's constantly shifting Pokemon opinions,https://twitter.com/radiopomp,juicy,https://twitter.com/radiopomp/status/598194594682171392,2021-01-26T18:54:56.281Z,https://twitter.com/search?q=lang%3Aen%20pokemon%20opinions&src=typed_query
Sun Apr 26 01:59:21 +0000 2020,794779537238323201,BWMaage,Drop your controversial pokemon opinions below I wanna see something,https://twitter.com/BWMaage,Cassie🐾,https://twitter.com/BWMaage/status/1254228540456947712,2021-01-26T18:54:56.281Z,https://twitter.com/search?q=lang%3Aen%20pokemon%20opinions&src=typed_query
Sat Aug 17 03:36:39 +0000 2019,4693712107,Ninkirboo570,"#4: Alolan Sandslash

Or Sleetslash as I like to call him. I've always just loved his design, and I actually used to write Pokemon stories where he was a main character. I gave him Beast Boy/TMNT 2012 Michelangelo's voice, which just made me like him even more XD. https://t.co/goJUKeRDXm",https://twitter.com/Ninkirboo570,❄NintIce2000❄,https://twitter.com/Ninkirboo570/status/1162568900313321472,2021-01-26T18:54:56.281Z,https://twitter.com/search?q=lang%3Aen%20pokemon%20opinions&src=typed_query
Mon Oct 07 00:49:43 +0000 2019,193101975,DeFriendlyTroll,"Bonus round: The main account her bio links to??? 

Folds my hands. 

Listen. This ain’t slick. It’s all either auto generated tweets or weird trans policing. Theres like. some pokemon opinions like three days back but. 

like what are you doing. https://t.co/b0amvKgbXB",https://twitter.com/DeFriendlyTroll,Friendly Frankenstein,https://twitter.com/DeFriendlyTroll/status/1181008667555983360,2021-01-26T18:54:56.281Z,https://twitter.com/search?q=lang%3Aen%20pokemon%20opinions&src=typed_query
Fri Jan 08 04:20:14 +0000 2021,1278877884669734917,ajb312,@rippleboba @McDonalddd_ @StardustYokai @RoIIerOut @akat_suk1 @xXPkDiaz26Xx YOU DO NOT MISS,https://twitter.com/ajb312,AJ Bickford,https://twitter.com/ajb312/status/1347397677085032450,2021-01-26T18:54:56.281Z,https://twitter.com/search?q=lang%3Aen%20pokemon%20opinions&src=typed_query
Tue Dec 10 01:15:52 +0000 2019,727587250658258946,RedBardIsCool,"Speaking of Alcremie, in case in wasn't obvious, I think it's safe to say that Alcremie has ended up being my favorite Galar Pokemon. That said, this gen has a TON of great Pokemon--a few other favs of mine are Sirfetch'd, Appltun, Perrserker, Mr. Rime, and Grookey to name a few.",https://twitter.com/RedBardIsCool,Red Bard (Kennedy),https://twitter.com/RedBardIsCool/status/1204208075357523968,2021-01-26T18:54:56.281Z,https://twitter.com/search?q=lang%3Aen%20pokemon%20opinions&src=typed_query
Tue Feb 20 21:38:52 +0000 2018,290675466,FormerlyRhi,@froonding_loom Angery chicken,https://twitter.com/FormerlyRhi,This Space for Rent,https://twitter.com/FormerlyRhi/status/966064634112499713,2021-01-26T18:54:56.281Z,https://twitter.com/search?q=lang%3Aen%20pokemon%20opinions&src=typed_query
Sat Feb 27 17:59:37 +0000 2016,2956962505,chidoriyoshino,I'm gonna go shower feel free to rip into my pokemon opinions while I'm gone,https://twitter.com/chidoriyoshino,Mother Bunger Unlimited,https://twitter.com/chidoriyoshino/status/703640644921663488,2021-01-26T18:54:56.281Z,https://twitter.com/search?q=lang%3Aen%20pokemon%20opinions&src=typed_query
Mon Sep 28 20:51:07 +0000 2020,1024037230409592834,bup_lmaoo,"im seeing lots of pokemon tier lists on my tl, so ive come to provice my tl with the pokemon opinions that would have me murdered at any pokemon convention https://t.co/cr75gorNoH",https://twitter.com/bup_lmaoo,the sound that toad makes,https://twitter.com/bup_lmaoo/status/1310683481555587072,2021-01-26T18:54:56.281Z,https://twitter.com/search?q=lang%3Aen%20pokemon%20opinions&src=typed_query
Mon Nov 12 18:24:19 +0000 2018,1406283367,tempurastick,Everyone has heated Pokémon opinions and you're all valid but what's important is that we join forces and delete mr mime now that he's out there in hyperrealism,https://twitter.com/tempurastick,tempu 👩‍❤️‍💋‍👩🌈 ocs on the mind,https://twitter.com/tempurastick/status/1062048460340387841,2021-01-26T18:54:56.281Z,https://twitter.com/search?q=lang%3Aen%20pokemon%20opinions&src=typed_query
Fri Mar 06 20:32:30 +0000 2020,1017649763775369216,SourBulba,"@twip98 All those people hating on you for your Pokémon opinions while you've literally got a Pokémon review code LOL, gg!",https://twitter.com/SourBulba,BulbaSour - Play Phoenix Wright: Ace Attorney,https://twitter.com/SourBulba/status/1236026892505034752,2021-01-26T18:54:56.281Z,https://twitter.com/search?q=lang%3Aen%20pokemon%20opinions&src=typed_query
Fri Jan 22 01:48:53 +0000 2021,1267075893282906113,JamesGr72711188,@nataliereed84 @EnifaelArt @TnashiAC @BeakyDoctor @JamesCraigie @PenisPillGril @marbo_real @LordJolemai @TheMindflayer99 @the_frishman @Luna_Lumen_Fox Are there good pokemon opinions?,https://twitter.com/JamesGr72711188,Omega Chapter Fortress,https://twitter.com/JamesGr72711188/status/1352433021316706307,2021-01-26T18:54:56.281Z,https://twitter.com/search?q=lang%3Aen%20pokemon%20opinions&src=typed_query
Sun Nov 26 21:39:40 +0000 2017,2966741349,Zoan1P,@ me if you have any Pokémon opinions you wanna arg...have a civil discussion about. 😇,https://twitter.com/Zoan1P,Ofomezie Emelle,https://twitter.com/Zoan1P/status/934899479601401856,2021-01-26T18:54:56.281Z,https://twitter.com/search?q=lang%3Aen%20pokemon%20opinions&src=typed_query
Sat Nov 16 23:52:07 +0000 2019,237483143,glassbottommeg,"Between the YA dust-up and people going after a 20 year old who had pokemon opinions, I feel like prominent folks need to remember they can just

Not say anything.

That's one of your biggest privileges as an established creator. Having no need to say anything. So just don't? Ya.",https://twitter.com/glassbottommeg,Megan Fox,https://twitter.com/glassbottommeg/status/1195852076984623104,2021-01-26T18:54:56.281Z,https://twitter.com/search?q=lang%3Aen%20pokemon%20opinions&src=typed_query
Fri Feb 02 02:21:35 +0000 2018,253320643,zaritarazi,@moonsideblues Bill paxton is DEAD aos how DARE you,https://twitter.com/zaritarazi,rachel,https://twitter.com/zaritarazi/status/959250413068439552,2021-01-26T18:54:56.281Z,https://twitter.com/search?q=lang%3Aen%20pokemon%20opinions&src=typed_query
Thu Nov 26 16:25:34 +0000 2020,2378289728,ChoctopusYT,"I drunkenly decided to go to war over Pokémon opinions last night LMAO. Sorry for being rude, peeps.",https://twitter.com/ChoctopusYT,Choctopus 🐙,https://twitter.com/ChoctopusYT/status/1331997534999470089,2021-01-26T18:54:56.281Z,https://twitter.com/search?q=lang%3Aen%20pokemon%20opinions&src=typed_query
Sun Jun 05 16:55:25 +0000 2016,2956962505,chidoriyoshino,I have good pokemon opinions guys,https://twitter.com/chidoriyoshino,Mother Bunger Unlimited,https://twitter.com/chidoriyoshino/status/739500887383543808,2021-01-26T18:54:56.281Z,https://twitter.com/search?q=lang%3Aen%20pokemon%20opinions&src=typed_query
Thu Oct 27 01:39:01 +0000 2016,3241303954,alolagary,"Pokemon Opinions (Full List):
-gary good",https://twitter.com/alolagary,espen,https://twitter.com/alolagary/status/791454118699237376,2021-01-26T18:54:56.281Z,https://twitter.com/search?q=lang%3Aen%20pokemon%20opinions&src=typed_query
Sun Apr 03 07:01:16 +0000 2016,1471374714,megidoIaon,pokemon opinions always turns into war,https://twitter.com/megidoIaon,(unintelligible),https://twitter.com/megidoIaon/status/716520927895224323,2021-01-26T18:54:56.281Z,https://twitter.com/search?q=lang%3Aen%20pokemon%20opinions&src=typed_query
Tue Jun 06 14:47:23 +0000 2017,1634383404,dreamcastpop,i just told wade all my pokemon opinions so now i feel better and i can move on.,https://twitter.com/dreamcastpop,Dawn of a New Year 🎊,https://twitter.com/dreamcastpop/status/872102627244482562,2021-01-26T18:54:56.281Z,https://twitter.com/search?q=lang%3Aen%20pokemon%20opinions&src=typed_query
Tue Jan 28 06:31:12 +0000 2020,3432551178,huetrooper,when I state my pokemon opinions all my friends abandon me,https://twitter.com/huetrooper,butchy bear 🐻,https://twitter.com/huetrooper/status/1222044436508495872,2021-01-26T18:54:56.281Z,https://twitter.com/search?q=lang%3Aen%20pokemon%20opinions&src=typed_query
Fri Dec 25 21:07:02 +0000 2020,1034897163908800512,RanbooHQ,based tommyinnit pokemon opinions,https://twitter.com/RanbooHQ,carson,https://twitter.com/RanbooHQ/status/1342577618441396224,2021-01-26T18:54:56.281Z,https://twitter.com/search?q=lang%3Aen%20pokemon%20opinions&src=typed_query
Tue Feb 20 21:40:34 +0000 2018,31322322,HitlerPuncher,"@spacetimeboss @froonding_loom I have very basic Pokémon opinions, but Flower Dinosaur still sounds good.",https://twitter.com/HitlerPuncher,Njolan Vøidsson’s Saga,https://twitter.com/HitlerPuncher/status/966065065798590470,2021-01-26T18:54:56.281Z,https://twitter.com/search?q=lang%3Aen%20pokemon%20opinions&src=typed_query
Wed Oct 21 21:26:24 +0000 2020,1021707406210818048,xXhollgamer79Xx,anyway i'm done with pokemon opinions it only brings misery,https://twitter.com/xXhollgamer79Xx,hollgay™🍄🔮,https://twitter.com/xXhollgamer79Xx/status/1319027281554075648,2021-01-26T18:54:56.281Z,https://twitter.com/search?q=lang%3Aen%20pokemon%20opinions&src=typed_query
Sat Sep 16 18:34:56 +0000 2017,14407231,betheymoth,"Thank you, twitter, for putting up with my questionable Pokemon opinions.",https://twitter.com/betheymoth,"Garr, Monstrous Meteor-Munching Malcontent Lv 1312",https://twitter.com/betheymoth/status/909123452883390465,2021-01-26T18:54:56.281Z,https://twitter.com/search?q=lang%3Aen%20pokemon%20opinions&src=typed_query
Tue Feb 11 08:08:01 +0000 2020,992343912,MasterTP1,"The thing I hate about doing these is that I inevitably will have to drop several favorites off due to repeated types.
But nonetheless, I've updated this to include my post Sword/Shield Pokemon opinions. https://t.co/stLLywddjW",https://twitter.com/MasterTP1,TP,https://twitter.com/MasterTP1/status/1227142231083098112,2021-01-26T18:54:56.281Z,https://twitter.com/search?q=lang%3Aen%20pokemon%20opinions&src=typed_query
Mon Nov 18 16:27:43 +0000 2019,3120236769,KaseboyAdvance,can jim sterling keep his stupid-ass boomer pokemon opinions to himself.,https://twitter.com/KaseboyAdvance,"hee ho, nigga",https://twitter.com/KaseboyAdvance/status/1196465014112161793,2021-01-26T18:54:56.281Z,https://twitter.com/search?q=lang%3Aen%20pokemon%20opinions&src=typed_query
Mon Jul 16 19:01:50 +0000 2018,1004761019552620545,shibbuen,"people start vomiting pokemon opinions in discord and the servers go down immediately, its a prophecy at this point",https://twitter.com/shibbuen,shib,https://twitter.com/shibbuen/status/1018933745305481216,2021-01-26T18:54:56.281Z,https://twitter.com/search?q=lang%3Aen%20pokemon%20opinions&src=typed_query
